{
  "schemaVersion": "2.0",
  "accountId": "123456789012",
  "region": "ap-northeast-1",
  "partition": "aws",
  "id": "unicode-test-finding-æµ‹è¯•-ğŸ”’",
  "arn": "arn:aws:guardduty:ap-northeast-1:123456789012:detector/unicode-test/finding/unicode-test-finding-æµ‹è¯•-ğŸ”’",
  "type": "Test:Unicode/SpecialCharacters",
  "resource": {
    "resourceType": "Instance",
    "instanceDetails": {
      "instanceId": "i-unicodeæµ‹è¯•123",
      "instanceType": "t3.micro",
      "launchTime": "2024-01-01T00:00:00.000Z",
      "platform": "linux",
      "instanceState": "running",
      "availabilityZone": "ap-northeast-1a",
      "tags": [
        {
          "key": "åå‰",
          "value": "ãƒ†ã‚¹ãƒˆã‚µãƒ¼ãƒãƒ¼"
        },
        {
          "key": "ç¯å¢ƒ",
          "value": "æµ‹è¯•ç¯å¢ƒ"
        },
        {
          "key": "Emoji",
          "value": "ğŸš€ğŸ”’ğŸ›¡ï¸"
        }
      ]
    }
  },
  "service": {
    "serviceName": "guardduty",
    "detectorId": "unicode-detector-æµ‹è¯•",
    "action": {
      "actionType": "DNS_REQUEST",
      "dnsRequestAction": {
        "domain": "æµ‹è¯•.example.com",
        "protocol": "UDP",
        "blocked": false
      }
    },
    "archived": false,
    "count": 1,
    "eventFirstSeen": "2024-01-01T12:00:00.000Z",
    "eventLastSeen": "2024-01-01T12:00:00.000Z",
    "resourceRole": "TARGET",
    "additionalInfo": {
      "value": "{\"unicode\": \"æµ‹è¯•\", \"emoji\": \"ğŸ”’\", \"special\": \"\\n\\t\\r\\\\\"}",
      "type": "unicode-test"
    }
  },
  "severity": 5.0,
  "createdAt": "2024-01-01T12:00:00.000Z",
  "updatedAt": "2024-01-01T12:00:00.000Z",
  "title": "Unicode Test Finding - æµ‹è¯•å‘ç° ğŸ”’",
  "description": "This finding contains Unicode characters (æµ‹è¯•), emoji (ğŸ”’ğŸ›¡ï¸), and special characters (\\n\\t\\r) to test proper JSON encoding and parsing of international content."
}