{
  "schemaVersion": "2.0",
  "accountId": "555666777888",
  "region": "eu-west-1",
  "partition": "aws",
  "id": "3b2c4d5e6f7g8h9i0j1k2l3m4n5o6p7q",
  "arn": "arn:aws:guardduty:eu-west-1:555666777888:detector/33def88c654b3a2109876543210987/finding/3b2c4d5e6f7g8h9i0j1k2l3m4n5o6p7q",
  "type": "CryptoCurrency:EC2/BitcoinTool.B!DNS",
  "resource": {
    "resourceType": "Instance",
    "instanceDetails": {
      "instanceId": "i-0abcdef123456789a",
      "instanceType": "c5.xlarge",
      "launchTime": "2024-01-03T06:00:00.000Z",
      "platform": "linux",
      "productCodes": [],
      "iamInstanceProfile": null,
      "networkInterfaces": [
        {
          "ipv6Addresses": [],
          "networkInterfaceId": "eni-abcdef12",
          "privateDnsName": "ip-10-1-2-50.eu-west-1.compute.internal",
          "privateIpAddress": "10.1.2.50",
          "privateIpAddresses": [
            {
              "privateDnsName": "ip-10-1-2-50.eu-west-1.compute.internal",
              "privateIpAddress": "10.1.2.50"
            }
          ],
          "subnetId": "subnet-abcdef12",
          "vpcId": "vpc-abcdef12",
          "securityGroups": [
            {
              "groupName": "compute-cluster",
              "groupId": "sg-abcdef12"
            }
          ],
          "publicDnsName": "ec2-52-30-40-50.eu-west-1.compute.amazonaws.com",
          "publicIp": "52.30.40.50"
        }
      ],
      "outpostArn": null,
      "tags": [
        {
          "key": "Name",
          "value": "ComputeNode-001"
        },
        {
          "key": "Project",
          "value": "DataProcessing"
        }
      ],
      "instanceState": "running",
      "availabilityZone": "eu-west-1c",
      "imageId": "ami-0fedcba987654321b",
      "imageDescription": "Ubuntu Server 20.04 LTS (HVM)"
    }
  },
  "service": {
    "serviceName": "guardduty",
    "detectorId": "33def88c654b3a2109876543210987",
    "action": {
      "actionType": "NETWORK_CONNECTION",
      "networkConnectionAction": {
        "connectionDirection": "OUTBOUND",
        "remoteIpDetails": {
          "ipAddressV4": "185.220.101.42",
          "organization": {
            "asn": "16509",
            "asnOrg": "Amazon.com, Inc.",
            "isp": "Amazon.com",
            "org": "Amazon Technologies Inc."
          },
          "country": {
            "countryCode": "US",
            "countryName": "United States"
          },
          "city": {
            "cityName": "Ashburn"
          },
          "geoLocation": {
            "lat": 39.0481,
            "lon": -77.4728
          }
        },
        "remotePortDetails": {
          "port": 8333,
          "portName": "Bitcoin"
        },
        "localPortDetails": {
          "port": 45678,
          "portName": "Unknown"
        },
        "protocol": "TCP",
        "blocked": false
      }
    },
    "evidence": {
      "threatIntelligenceDetails": [
        {
          "threatListName": "BitcoinAbuse",
          "threatNames": [
            "bitcoin-mining-pool",
            "cryptocurrency-infrastructure"
          ]
        }
      ]
    },
    "archived": false,
    "count": 42,
    "eventFirstSeen": "2024-01-03T08:00:00.000Z",
    "eventLastSeen": "2024-01-03T12:30:00.000Z",
    "resourceRole": "ACTOR",
    "additionalInfo": {
      "value": "{\"sample\": true, \"threatFamily\": \"CryptoCurrency\", \"miningPool\": \"detected\"}",
      "type": "default"
    },
    "featureName": "FlowLogs"
  },
  "severity": 6.5,
  "createdAt": "2024-01-03T08:00:00.000Z",
  "updatedAt": "2024-01-03T12:30:00.000Z",
  "title": "CryptoCurrency:EC2/BitcoinTool.B!DNS",
  "description": "EC2 instance i-0abcdef123456789a is communicating with a remote host that is associated with Bitcoin cryptocurrency mining. This may indicate unauthorized cryptocurrency mining activity on your instance."
}