{
  "schemaVersion": "2.0",
  "accountId": "444555666777",
  "region": "eu-central-1",
  "partition": "aws",
  "id": "7f6g8h9i0j1k2l3m4n5o6p7q8r9s0t1u",
  "arn": "arn:aws:guardduty:eu-central-1:444555666777:detector/77g112g098f7e6543210987654321/finding/7f6g8h9i0j1k2l3m4n5o6p7q8r9s0t1u",
  "type": "Execution:Runtime/NewBinaryExecuted",
  "resource": {
    "resourceType": "Instance",
    "instanceDetails": {
      "instanceId": "i-0123456789abcdef1",
      "instanceType": "t3.small",
      "launchTime": "2024-01-07T05:00:00.000Z",
      "platform": "linux",
      "productCodes": [],
      "iamInstanceProfile": {
        "arn": "arn:aws:iam::444555666777:instance-profile/WebServer-Role",
        "id": "AIPCL45JA49UK8HQNIPS4"
      },
      "networkInterfaces": [
        {
          "ipv6Addresses": [],
          "networkInterfaceId": "eni-0abcdef123456789",
          "privateDnsName": "ip-10-2-3-75.eu-central-1.compute.internal",
          "privateIpAddress": "10.2.3.75",
          "privateIpAddresses": [
            {
              "privateDnsName": "ip-10-2-3-75.eu-central-1.compute.internal",
              "privateIpAddress": "10.2.3.75"
            }
          ],
          "subnetId": "subnet-0123456789abcdef",
          "vpcId": "vpc-0123456789abcdef",
          "securityGroups": [
            {
              "groupName": "web-tier",
              "groupId": "sg-0123456789abcdef"
            }
          ],
          "publicDnsName": "ec2-18-185-100-75.eu-central-1.compute.amazonaws.com",
          "publicIp": "18.185.100.75"
        }
      ],
      "outpostArn": null,
      "tags": [
        {
          "key": "Name",
          "value": "WebApp-Server"
        },
        {
          "key": "Environment",
          "value": "Production"
        }
      ],
      "instanceState": "running",
      "availabilityZone": "eu-central-1a",
      "imageId": "ami-0c02fb55956c7d316",
      "imageDescription": "Amazon Linux 2 AMI (HVM) - Kernel 5.10"
    }
  },
  "service": {
    "serviceName": "guardduty",
    "detectorId": "77g112g098f7e6543210987654321",
    "runtimeDetails": {
      "process": {
        "name": "suspicious_miner",
        "executablePath": "/tmp/.hidden/suspicious_miner",
        "executableSha256": "e3b0c44298fc1c149afbf4c8996fb92427ae41e4649b934ca495991b7852b855",
        "namespacePid": 12345,
        "pwd": "/tmp/.hidden",
        "pid": 12345,
        "startTime": "2024-01-07T11:30:00.000Z",
        "uuid": "12345678-1234-5678-9abc-123456789012",
        "parentUuid": "87654321-4321-8765-cba9-210987654321",
        "user": "www-data",
        "userId": 33,
        "euid": 33,
        "lineage": [
          {
            "startTime": "2024-01-07T11:29:00.000Z",
            "namespacePid": 12344,
            "userId": 33,
            "name": "bash",
            "pid": 12344,
            "uuid": "87654321-4321-8765-cba9-210987654321",
            "executablePath": "/bin/bash",
            "euid": 33,
            "parentUuid": "11111111-2222-3333-4444-555555555555"
          }
        ]
      },
      "context": {
        "modifyingProcess": {
          "name": "wget",
          "executablePath": "/usr/bin/wget",
          "executableSha256": "a1b2c3d4e5f6789012345678901234567890123456789012345678901234567890",
          "namespacePid": 12343,
          "pwd": "/tmp",
          "pid": 12343,
          "startTime": "2024-01-07T11:28:00.000Z",
          "uuid": "11111111-2222-3333-4444-555555555555",
          "user": "www-data",
          "userId": 33,
          "euid": 33
        },
        "modifiedAt": "2024-01-07T11:29:30.000Z",
        "scriptPath": "/tmp/download_and_run.sh",
        "targetProcess": {
          "name": "suspicious_miner",
          "executablePath": "/tmp/.hidden/suspicious_miner",
          "pid": 12345,
          "uuid": "12345678-1234-5678-9abc-123456789012"
        },
        "threatFilePath": "/tmp/.hidden/suspicious_miner"
      }
    },
    "evidence": {
      "threatIntelligenceDetails": [
        {
          "threatListName": "GuardDuty-Malware",
          "threatNames": [
            "Linux.Trojan.Miner",
            "Cryptocurrency-Miner"
          ]
        }
      ]
    },
    "archived": false,
    "count": 1,
    "eventFirstSeen": "2024-01-07T11:30:00.000Z",
    "eventLastSeen": "2024-01-07T11:30:00.000Z",
    "resourceRole": "TARGET",
    "additionalInfo": {
      "value": "{\"sample\": true, \"threatFamily\": \"Malware\", \"binaryType\": \"cryptocurrency-miner\"}",
      "type": "default"
    },
    "featureName": "RuntimeMonitoring"
  },
  "severity": 8.2,
  "createdAt": "2024-01-07T11:30:00.000Z",
  "updatedAt": "2024-01-07T11:30:00.000Z",
  "title": "Execution:Runtime/NewBinaryExecuted",
  "description": "A new binary suspicious_miner was executed on EC2 instance i-0123456789abcdef1. This binary was not present when the instance was launched and may indicate malicious activity such as cryptocurrency mining or other unauthorized software execution."
}