{
  "schemaVersion": "2.0",
  "accountId": "000000000000",
  "region": "us-east-1",
  "partition": "aws",
  "id": "minimal-test-finding",
  "arn": "arn:aws:guardduty:us-east-1:000000000000:detector/minimal/finding/minimal-test-finding",
  "type": "Test:Minimal/Finding",
  "resource": {
    "resourceType": "Instance"
  },
  "service": {
    "serviceName": "guardduty",
    "detectorId": "minimal-detector",
    "archived": false,
    "count": 1,
    "eventFirstSeen": "2024-01-01T00:00:00.000Z",
    "eventLastSeen": "2024-01-01T00:00:00.000Z",
    "resourceRole": "TARGET"
  },
  "severity": 0.0,
  "createdAt": "2024-01-01T00:00:00.000Z",
  "updatedAt": "2024-01-01T00:00:00.000Z",
  "title": "Minimal Test Finding",
  "description": "This is a minimal finding with only required fields for testing edge cases."
}